{
  "ingredients": [
    {
      "ingredient_key": "tomato",
      "locale": "cs-CZ",
      "title": "Rajče",
      "slug": "rajce",
      "aliases": [
        "rajčata",
        "rajčat",
        "rajčete"
      ],
      "default_unit": "ks"
    },
    {
      "ingredient_key": "pasta-spaghetti",
      "locale": "cs-CZ",
      "title": "Spaghetti",
      "slug": "spagety",
      "aliases": [
        "špagety"
      ],
      "default_unit": "g"
    },
    {
      "ingredient_key": "guanciale",
      "locale": "cs-CZ",
      "title": "Guanciale",
      "slug": "guanciale",
      "aliases": [],
      "default_unit": "g"
    },
    {
      "ingredient_key": "egg",
      "locale": "cs-CZ",
      "title": "Vejce",
      "slug": "vejce",
      "aliases": [
        "vajíčko",
        "vajíčka"
      ],
      "default_unit": "ks"
    },
    {
      "ingredient_key": "pecorino-romano",
      "locale": "cs-CZ",
      "title": "Pecorino Romano",
      "slug": "pecorino-romano",
      "aliases": [
        "pecorino"
      ],
      "default_unit": "g"
    },
    {
      "ingredient_key": "black-pepper",
      "locale": "cs-CZ",
      "title": "Černý pepř",
      "slug": "cerny-pepr",
      "aliases": [
        "pepř"
      ],
      "default_unit": ""
    },
    {
      "ingredient_key": "salt",
      "locale": "cs-CZ",
      "title": "Sůl",
      "slug": "sul",
      "aliases": [],
      "default_unit": ""
    },
    {
      "ingredient_key": "pork-belly",
      "locale": "cs-CZ",
      "title": "Vepřový bůček",
      "slug": "veprovy-bucek",
      "aliases": [
        "bůček"
      ],
      "default_unit": "g"
    },
    {
      "ingredient_key": "miso-paste",
      "locale": "cs-CZ",
      "title": "Miso pasta",
      "slug": "miso-pasta",
      "aliases": [
        "miso"
      ],
      "default_unit": "lžíce"
    },
    {
      "ingredient_key": "soy-sauce",
      "locale": "cs-CZ",
      "title": "Sójová omáčka",
      "slug": "sojova-omacka",
      "aliases": [
        "sojovka"
      ],
      "default_unit": "lžíce"
    },
    {
      "ingredient_key": "dashi",
      "locale": "cs-CZ",
      "title": "Vývar dashi",
      "slug": "dashi",
      "aliases": [
        "dashi vývar"
      ],
      "default_unit": "l"
    },
    {
      "ingredient_key": "ramen-noodles",
      "locale": "cs-CZ",
      "title": "Ramen nudle",
      "slug": "ramen-nudle",
      "aliases": [],
      "default_unit": "porce"
    },
    {
      "ingredient_key": "rice-noodles",
      "locale": "cs-CZ",
      "title": "Rýžové nudle",
      "slug": "ryzove-nudle",
      "aliases": [],
      "default_unit": "g"
    },
    {
      "ingredient_key": "shrimp",
      "locale": "cs-CZ",
      "title": "Krevety",
      "slug": "krevety",
      "aliases": [],
      "default_unit": "g"
    },
    {
      "ingredient_key": "tamarind-paste",
      "locale": "cs-CZ",
      "title": "Tamarindová pasta",
      "slug": "tamarindova-pasta",
      "aliases": [
        "tamarind"
      ],
      "default_unit": "lžíce"
    },
    {
      "ingredient_key": "fish-sauce",
      "locale": "cs-CZ",
      "title": "Rybí omáčka",
      "slug": "rybi-omacka",
      "aliases": [],
      "default_unit": "lžíce"
    },
    {
      "ingredient_key": "peanut",
      "locale": "cs-CZ",
      "title": "Arašídy",
      "slug": "arasidy",
      "aliases": [
        "burák",
        "buráky"
      ],
      "default_unit": "hrnku"
    }
  ],
  "countries": [
    {
      "translation_status": "published",
      "locale": "cs-CZ",
      "title": "Itálie",
      "slug": "italie",
      "name_cs": "Itálie",
      "name_en": "Italy",
      "iso_code": "IT",
      "flag_emoji": "🇮🇹",
      "continent": "europe",
      "capital": "Řím",
      "languages": [
        "Italština"
      ],
      "currency": "Euro (€)",
      "area_km2": 301340,
      "population": 59000000,
      "population_year": 2024,
      "intro": "Italská kuchyně stojí na jednoduchosti a kvalitě surovin, ne na složitosti postupu.",
      "taste_intro": "Málo ingrediencí, ale ty nejlepší, jaké lze sehnat – zralá rajčata, dobrý olivový olej, čerstvé bylinky.",
      "typical_ingredients": [
        "Rajčata",
        "Olivový olej",
        "Bazalka",
        "Parmezán",
        "Těstoviny",
        "Rýže"
      ],
      "traditional_dishes": [
        {
          "name": "Pizza",
          "note": "Tenké těsto pečené na vysokou teplotu.",
          "recipe_id": ""
        },
        {
          "name": "Carbonara",
          "note": "Vejce, guanciale a pecorino.",
          "recipe_id": "spaghetti-carbonara"
        }
      ],
      "must_try": [
        {
          "name": "Pizza Napoletana",
          "note": "Tenké těsto, San Marzano rajčata, mozzarella di bufala."
        },
        {
          "name": "Carbonara",
          "note": "Vejce, guanciale a pecorino – bez smetany."
        }
      ],
      "fun_facts": [
        "Al dente doslova znamená „na skus“ – těstoviny se nikdy nerozvařují."
      ],
      "related_glossary": [
        "al-dente",
        "soffritto"
      ],
      "related_countries": [
        "JP",
        "TH"
      ],
      "seo_title": "Itálie – italská kuchyně, recepty a tradiční jídla | Atlas chutí",
      "meta_description": "Poznejte italskou kuchyni: typické suroviny, tradiční jídla a ověřené recepty.",
      "status": "publish"
    },
    {
      "translation_status": "published",
      "locale": "cs-CZ",
      "title": "Japonsko",
      "slug": "japonsko",
      "name_cs": "Japonsko",
      "name_en": "Japan",
      "iso_code": "JP",
      "flag_emoji": "🇯🇵",
      "continent": "asia",
      "capital": "Tokio",
      "languages": [
        "Japonština"
      ],
      "currency": "Jen (¥)",
      "area_km2": 377975,
      "population": 123000000,
      "population_year": 2024,
      "intro": "Přesnost, sezónnost a čistá chuť syrových i fermentovaných surovin.",
      "taste_intro": "Umami, jemné slané tóny dashi a rovnováha mezi syrovým a vařeným.",
      "typical_ingredients": [
        "Sójová omáčka",
        "Miso",
        "Rýže",
        "Dashi",
        "Wasabi",
        "Nori"
      ],
      "traditional_dishes": [
        {
          "name": "Ramen",
          "note": "Nudlová polévka s bohatým vývarem.",
          "recipe_id": "miso-ramen"
        },
        {
          "name": "Sushi",
          "note": "Octová rýže s rybou nebo zeleninou.",
          "recipe_id": ""
        }
      ],
      "must_try": [
        {
          "name": "Ramen",
          "note": "Hluboký vývar a domácí nudle."
        },
        {
          "name": "Sushi",
          "note": "Čerstvá ryba a octová rýže."
        }
      ],
      "fun_facts": [
        "Dashi je základem naprosté většiny japonských vývarů a polévek."
      ],
      "related_glossary": [
        "miso",
        "dashi"
      ],
      "related_countries": [
        "TH"
      ],
      "seo_title": "Japonsko – japonská kuchyně, recepty a tradiční jídla | Atlas chutí",
      "meta_description": "Poznejte japonskou kuchyni: typické suroviny, tradiční jídla a ověřené recepty.",
      "status": "publish"
    },
    {
      "translation_status": "published",
      "locale": "cs-CZ",
      "title": "Thajsko",
      "slug": "thajsko",
      "name_cs": "Thajsko",
      "name_en": "Thailand",
      "iso_code": "TH",
      "flag_emoji": "🇹🇭",
      "continent": "asia",
      "capital": "Bangkok",
      "languages": [
        "Thajština"
      ],
      "currency": "Baht (฿)",
      "area_km2": 513120,
      "population": 71000000,
      "population_year": 2024,
      "intro": "Aromatická kuchyně kombinující sladké, kyselé, slané a pálivé chutě.",
      "taste_intro": "Rovnováha čtyř základních chutí v jednom soustu, hodně bylinek a čerstvého chilli.",
      "typical_ingredients": [
        "Rybí omáčka",
        "Kokosové mléko",
        "Citronová tráva",
        "Rýžové nudle",
        "Chilli",
        "Limetka"
      ],
      "traditional_dishes": [
        {
          "name": "Pad Thai",
          "note": "Smažené rýžové nudle s tamarindovou omáčkou.",
          "recipe_id": "pad-thai"
        },
        {
          "name": "Tom Yum",
          "note": "Pálivo-kyselá polévka s citronovou trávou.",
          "recipe_id": ""
        }
      ],
      "must_try": [
        {
          "name": "Pad Thai",
          "note": "Sladko-kyselo-slaná klasika ulic Bangkoku."
        },
        {
          "name": "Tom Yum Goong",
          "note": "Pálivá polévka s krevetami a citronovou trávou."
        }
      ],
      "fun_facts": [
        "Thajská kuchyně staví na rovnováze sladké, kyselé, slané a pálivé chuti v jednom jídle."
      ],
      "related_glossary": [],
      "related_countries": [
        "JP"
      ],
      "seo_title": "Thajsko – thajská kuchyně, recepty a tradiční jídla | Atlas chutí",
      "meta_description": "Poznejte thajskou kuchyni: typické suroviny, tradiční jídla a ověřené recepty.",
      "status": "publish"
    }
  ],
  "glossary": [
    {
      "title": "Al dente",
      "slug": "al-dente",
      "category": "technique",
      "short_definition": "Stupeň uvaření těstovin či rýže „na skus“, kdy si zachovávají mírný odpor.",
      "detailed": "Al dente doslova znamená „na zub“. Ochutnávejte cca minutu před uplynutím doby uvedené na obalu.",
      "origin_country": "IT",
      "related_recipes": [
        "spaghetti-carbonara"
      ],
      "related_countries": [
        "IT"
      ],
      "status": "publish",
      "locale": "cs-CZ",
      "translation_group": "al-dente",
      "translation_status": "published"
    },
    {
      "title": "Soffritto",
      "slug": "soffritto",
      "category": "technique",
      "short_definition": "Základ italských jídel z pomalu restované cibule, mrkve a celeru.",
      "detailed": "Trojice zeleniny nakrájená najemno a pomalu restovaná na oleji nebo másle, dokud nezesklovatí – základ mnoha italských omáček a vývarů.",
      "origin_country": "IT",
      "related_recipes": [],